{
  "depth_reason": "3 levels: m.koch is on Free",
  "plan": "free",
  "trial": false,
  "charged_to": {
    "kind": "person",
    "subject": "account:acc_3qk2m7x9p4t8w1v6r5ya",
    "login": "m.koch"
  },
  "meter": "runs",
  "resets_at": "2026-09-28T00:00:00+00:00",
  "full_analysis": true,
  "mode": "enforce",
  "fail_open": false,
  "wall": null,
  "allowed": true,
  "run_id": "github:acme-corp/billing-service#11809532110",
  "depth_cap": 3,
  "counted": false,
  "used": 4,
  "limit": 5,
  "remaining": 1
}
